{
  "experiment_contract_format": 1,
  "contract_id": "m8-agent-experiment-v1",
  "benchmark_id": "ail-job-service",
  "authority": {
    "decision": "docs/decisions/0002-m8-agent-experiment-contract.md",
    "requirements": [
      "NFR-001",
      "NFR-002",
      "NFR-003",
      "NFR-004",
      "NFR-005"
    ]
  },
  "agent": {
    "provider": "openai-responses",
    "model_request": "gpt-5.6-sol",
    "reasoning_effort": "high",
    "mode": "standard",
    "agent": "one-root-codex-cli",
    "agent_version": "codex-cli 0.144.6",
    "agent_sha256": "80a3933d11a9d13ef806aa24f7bb8afc9169cfe4e9b09d6da6a92922cbde9cff",
    "delegation": "disabled",
    "sampling": {
      "temperature": "unavailable",
      "top_p": "unavailable",
      "seed": "unavailable"
    }
  },
  "protocol": {
    "command": [
      "codex",
      "exec",
      "--json",
      "--ephemeral",
      "--strict-config",
      "--color",
      "never",
      "-C",
      "{workspace}",
      "-m",
      "gpt-5.6-sol",
      "-"
    ],
    "model_turns": "adaptive-local-tools",
    "human_follow_up": "disabled",
    "thread_resume": "disabled",
    "response_schema": "none",
    "request_retries": 0,
    "stream_retries": 0,
    "stream_idle_seconds": 300,
    "model_reasoning_summary": "none",
    "model_verbosity": "medium",
    "personality": "none",
    "approval_policy": "never",
    "web_search": "disabled",
    "history_persistence": "disabled",
    "startup_update_check": "disabled"
  },
  "prompt": {
    "prefix_sha256": "a6d8c11a634baa066204e1c96fc654e1fa79b01e53e26018c47fae1c8082c60a",
    "suffix_sha256": "eba2d2e6bf04a2fc8146c4b32767b3a890b1aa9388898c17d5771d86c576f924",
    "rendered": [
      {
        "task": "UC-001",
        "task_sha256": "6b1bec05983bf8442e2a9981d20a64cdbc00e6712edca5785f8610c1708fbefa",
        "rendered_prompt_sha256": "f07eea02a65a73d1602af079494414b26e7a83f3f00bd9758342114e762b10da"
      },
      {
        "task": "UC-003",
        "task_sha256": "f540353fa948fda0d3c6880e8c4b69e79133f0a63abb6978e22f3e12d86fecd6",
        "rendered_prompt_sha256": "827ab3889a5c45469f70ef31875e38b283a47c5c57089edf79d678576488129f"
      }
    ]
  },
  "initial_context": [
    "version-bound-codex-base-instructions",
    "built-in-local-tool-schemas",
    "exact-rendered-task-prompt",
    "minimal-fixed-transport-metadata"
  ],
  "task_starts": [
    {
      "configuration_id": "rust-uc001",
      "language": "rust",
      "task": "UC-001",
      "tree_sha256": "fd2cd795289e4aa6206172251df94e35def6a84720bd13f943e827e2b5a5aa35"
    },
    {
      "configuration_id": "rust-uc003",
      "language": "rust",
      "task": "UC-003",
      "tree_sha256": "10ee07da629ca4b15c959efa90202713e93cd0e303c69c7dbd55884bfdd39b40"
    },
    {
      "configuration_id": "go-uc001",
      "language": "go",
      "task": "UC-001",
      "tree_sha256": "e029709a2ac1005face809cad2c126883fc85e416a6173f4194826694c77bfbe"
    },
    {
      "configuration_id": "go-uc003",
      "language": "go",
      "task": "UC-003",
      "tree_sha256": "2fe6c4b2886bc57d67f1c86cd4de6585ec1d291597529c4d6ba2024c34b2f64a"
    },
    {
      "configuration_id": "python-uc001",
      "language": "python",
      "task": "UC-001",
      "tree_sha256": "8719eebdf4531df0ff5c47a3922544edfb33c8fc930c0971444104ca6dca480e"
    },
    {
      "configuration_id": "python-uc003",
      "language": "python",
      "task": "UC-003",
      "tree_sha256": "33dab557665788563768c37cef336a1fb5dbc09301189d834b02bf42574052ff"
    },
    {
      "configuration_id": "typescript-uc001",
      "language": "typescript",
      "task": "UC-001",
      "tree_sha256": "49b30f0089f14577514ee282046591f4335222f9952c1e71eeb38fc6dfb41711"
    },
    {
      "configuration_id": "typescript-uc003",
      "language": "typescript",
      "task": "UC-003",
      "tree_sha256": "a13c469154a5ad70f44fb87e6ba67819845e135babab886b25ddee5a288a7a0f"
    }
  ],
  "tools": {
    "common": [
      "codex-shell",
      "codex-file-edit",
      "read-only-discovery",
      "git-status",
      "git-diff"
    ],
    "rust": [
      "rustc 1.88.0",
      "cargo 1.88.0",
      "rustfmt 1.8.0",
      "clippy 0.1.88",
      "rust-analyzer 1.88.0"
    ],
    "go": [
      "go 1.26.0",
      "gofmt 1.26.0",
      "go vet 1.26.0",
      "gopls 0.21.1"
    ],
    "python": [
      "cpython 3.13.5",
      "uv 0.7.12",
      "mypy 1.17.0",
      "ruff 0.12.4",
      "pytest 8.4.1"
    ],
    "typescript": [
      "node 23.10.0",
      "npm 10.9.2",
      "typescript 5.8.3",
      "eslint 9.31.0",
      "prettier 3.6.2",
      "tsx 4.20.3",
      "c8 10.1.3"
    ]
  },
  "token_accounting": {
    "authoritative_total": "provider-reported-request-usage",
    "preflight_counter": "POST /v1/responses/input_tokens",
    "attribution": "ordered-cumulative-prefix-delta-v1",
    "categories": [
      "initial_context",
      "source_reads",
      "semantic_tool_output",
      "diagnostics",
      "build_and_test_output",
      "other_tool_output"
    ],
    "cached_input_deducted": "no",
    "repeated_delivery_counted": "yes",
    "reconciliation_tolerance_tokens": 0,
    "unreconciled_result": "incomplete_evidence"
  },
  "permissions": {
    "filesystem": "generated-least-privilege-profile",
    "agent_workspace_read": "allowed",
    "editable_files_write": "allowed",
    "protected_files_write": "denied",
    "parent_repository_read": "denied",
    "private_package_read": "denied",
    "evidence_read": "denied",
    "agent_subprocess_network": "denied",
    "control_plane": "loopback-recorder-only",
    "host_environment": "allowlist-only",
    "subprocesses": "record-all"
  },
  "limits": {
    "agent_wall_seconds": 600,
    "cumulative_input_tokens": 500000,
    "termination_grace_seconds": 5,
    "warm_corpus_seconds": 30,
    "cold_start_milliseconds": 2000,
    "peak_rss_bytes": 536870912
  },
  "terminal_classes": [
    "configuration_rejection",
    "failed",
    "timed_out",
    "successful"
  ],
  "environment": {
    "reference_host": "ail-m8-reference-mac-01",
    "operating_system": "macOS 26.5.2",
    "operating_system_build": "25F84",
    "architecture": "apple-arm64",
    "container": "none",
    "campaign_concurrency": "sequential",
    "external_dependencies": "preprovisioned-offline"
  },
  "performance": {
    "successful_agent_trials_per_configuration": 10,
    "warm_measurements_per_language": 30,
    "cold_measurements_per_language": 30,
    "warm_metrics": [
      "throughput",
      "p50_latency",
      "p95_latency",
      "p99_latency",
      "variance"
    ],
    "cold_metrics": [
      "process_creation",
      "readiness",
      "idle_rss",
      "peak_rss",
      "package",
      "dependency_lock",
      "external_access",
      "corpus_correctness"
    ]
  },
  "schemas": [
    "benchmarks/schemas/calibration-experiment-contract.schema.json",
    "benchmarks/schemas/calibration-campaign.schema.json",
    "benchmarks/schemas/calibration-agent-trial.schema.json",
    "benchmarks/schemas/calibration-raw-event.schema.json",
    "benchmarks/schemas/calibration-warm-measurement.schema.json",
    "benchmarks/schemas/calibration-cold-measurement.schema.json",
    "benchmarks/schemas/calibration-evidence-index.schema.json",
    "benchmarks/schemas/calibration-report.schema.json"
  ]
}
